{
  "$id": "lanjing://schemas/sources/legado/source.schema.v1.json",
  "$schema": "https://json-schema.org/draft/2020-12/schema",
  "additionalProperties": true,
  "properties": {
    "bookSourceComment": {
      "description": "来源作者、状态与说明",
      "oneOf": [
        {
          "maxLength": 262144,
          "type": "string",
          "x-lanjing-max-utf8-bytes": 262144
        },
        {
          "type": "null"
        }
      ],
      "x-lanjing-group": "basic",
      "x-lanjing-importer-owner": "lj-importer::authoring::document",
      "x-lanjing-runtime-owner": "not_executable",
      "x-lanjing-sensitivity": "none",
      "x-lanjing-support": "preserved"
    },
    "bookSourceGroup": {
      "description": "来源分组与展示标签",
      "oneOf": [
        {
          "maxLength": 262144,
          "type": "string",
          "x-lanjing-max-utf8-bytes": 262144
        },
        {
          "type": "null"
        }
      ],
      "x-lanjing-group": "basic",
      "x-lanjing-importer-owner": "lj-importer::legado::types",
      "x-lanjing-runtime-owner": "lj-media::SourceProfile",
      "x-lanjing-sensitivity": "none",
      "x-lanjing-support": "executable"
    },
    "bookSourceName": {
      "description": "显示在来源列表中的名称",
      "maxLength": 262144,
      "type": "string",
      "x-lanjing-group": "basic",
      "x-lanjing-importer-owner": "lj-importer::legado::types",
      "x-lanjing-max-utf8-bytes": 262144,
      "x-lanjing-runtime-owner": "lj-media::SourceProfile",
      "x-lanjing-sensitivity": "none",
      "x-lanjing-support": "executable"
    },
    "bookSourceType": {
      "description": "源类型：0 文本、1 音频、2 图片、3 文件；v1 仅执行文本源",
      "type": "integer",
      "x-lanjing-group": "basic",
      "x-lanjing-importer-owner": "lj-importer::authoring::document",
      "x-lanjing-runtime-owner": "lj-media::SourceProfile",
      "x-lanjing-sensitivity": "none",
      "x-lanjing-support": "executable"
    },
    "bookSourceUrl": {
      "description": "来源基础 URL，必须是无 credential query 的 http/https 地址",
      "maxLength": 262144,
      "type": "string",
      "x-lanjing-group": "basic",
      "x-lanjing-importer-owner": "lj-importer::legado::translator",
      "x-lanjing-max-utf8-bytes": 262144,
      "x-lanjing-runtime-owner": "lj-node-http::HttpEffectAdapter",
      "x-lanjing-sensitivity": "sensitive_url",
      "x-lanjing-support": "executable"
    },
    "bookUrlPattern": {
      "description": "详情 URL 的来源专属校验正则",
      "oneOf": [
        {
          "maxLength": 262144,
          "type": "string",
          "x-lanjing-max-utf8-bytes": 262144
        },
        {
          "type": "null"
        }
      ],
      "x-lanjing-group": "basic",
      "x-lanjing-importer-owner": "lj-importer::authoring::document",
      "x-lanjing-runtime-owner": "blocked",
      "x-lanjing-sensitivity": "none",
      "x-lanjing-support": "blocked"
    },
    "concurrentRate": {
      "description": "上游请求并发率与访问间隔",
      "oneOf": [
        {
          "maxLength": 262144,
          "type": "string",
          "x-lanjing-max-utf8-bytes": 262144
        },
        {
          "type": "null"
        }
      ],
      "x-lanjing-group": "basic",
      "x-lanjing-importer-owner": "lj-importer::authoring::document",
      "x-lanjing-runtime-owner": "blocked",
      "x-lanjing-sensitivity": "none",
      "x-lanjing-support": "blocked"
    },
    "coverDecodeJs": {
      "description": "上游封面解密 JavaScript",
      "oneOf": [
        {
          "maxLength": 262144,
          "type": "string",
          "x-lanjing-max-utf8-bytes": 262144
        },
        {
          "type": "null"
        }
      ],
      "x-lanjing-group": "basic",
      "x-lanjing-importer-owner": "lj-importer::authoring::document",
      "x-lanjing-runtime-owner": "blocked",
      "x-lanjing-sensitivity": "none",
      "x-lanjing-support": "blocked"
    },
    "customOrder": {
      "description": "客户端手动排序编号",
      "oneOf": [
        {
          "type": "integer"
        },
        {
          "type": "null"
        }
      ],
      "x-lanjing-group": "preferences",
      "x-lanjing-importer-owner": "lj-importer::authoring::document",
      "x-lanjing-runtime-owner": "not_executable",
      "x-lanjing-sensitivity": "none",
      "x-lanjing-support": "preserved"
    },
    "enabled": {
      "description": "客户端启用偏好",
      "oneOf": [
        {
          "type": "boolean"
        },
        {
          "type": "null"
        }
      ],
      "x-lanjing-group": "preferences",
      "x-lanjing-importer-owner": "lj-importer::authoring::document",
      "x-lanjing-runtime-owner": "not_executable",
      "x-lanjing-sensitivity": "none",
      "x-lanjing-support": "preserved"
    },
    "enabledCookieJar": {
      "description": "上游 CookieJar 自动持久化",
      "oneOf": [
        {
          "type": "boolean"
        },
        {
          "type": "null"
        }
      ],
      "x-lanjing-group": "preferences",
      "x-lanjing-importer-owner": "lj-importer::authoring::document",
      "x-lanjing-runtime-owner": "blocked",
      "x-lanjing-sensitivity": "none",
      "x-lanjing-support": "blocked"
    },
    "enabledExplore": {
      "description": "客户端发现页启用偏好",
      "oneOf": [
        {
          "type": "boolean"
        },
        {
          "type": "null"
        }
      ],
      "x-lanjing-group": "preferences",
      "x-lanjing-importer-owner": "lj-importer::authoring::document",
      "x-lanjing-runtime-owner": "not_executable",
      "x-lanjing-sensitivity": "none",
      "x-lanjing-support": "preserved"
    },
    "exploreScreen": {
      "description": "上游发现筛选规则",
      "oneOf": [
        {
          "maxLength": 262144,
          "type": "string",
          "x-lanjing-max-utf8-bytes": 262144
        },
        {
          "type": "null"
        }
      ],
      "x-lanjing-group": "explore",
      "x-lanjing-importer-owner": "lj-importer::authoring::document",
      "x-lanjing-runtime-owner": "blocked",
      "x-lanjing-sensitivity": "none",
      "x-lanjing-support": "blocked"
    },
    "exploreUrl": {
      "description": "发现入口；当前仅进入既有受限 QuickJS effect",
      "oneOf": [
        {
          "maxLength": 262144,
          "type": "string",
          "x-lanjing-max-utf8-bytes": 262144
        },
        {
          "type": "null"
        }
      ],
      "x-lanjing-group": "explore",
      "x-lanjing-importer-owner": "lj-importer::legado::translator",
      "x-lanjing-runtime-owner": "lj-node-js::QuickJsEffectAdapter",
      "x-lanjing-sensitivity": "sensitive_url",
      "x-lanjing-support": "executable"
    },
    "header": {
      "description": "JSON string header map；credential 由 slot codec 分离",
      "oneOf": [
        {
          "maxLength": 262144,
          "type": "string",
          "x-lanjing-max-utf8-bytes": 262144
        },
        {
          "type": "null"
        }
      ],
      "x-lanjing-group": "basic",
      "x-lanjing-importer-owner": "lj-importer::legado::translator",
      "x-lanjing-runtime-owner": "lj-node-http::HttpEffectAdapter",
      "x-lanjing-sensitivity": "credential_container",
      "x-lanjing-support": "executable"
    },
    "jsLib": {
      "description": "上游 JavaScript 库与远程脚本加载",
      "oneOf": [
        {
          "maxLength": 262144,
          "type": "string",
          "x-lanjing-max-utf8-bytes": 262144
        },
        {
          "type": "null"
        }
      ],
      "x-lanjing-group": "basic",
      "x-lanjing-importer-owner": "lj-importer::authoring::document",
      "x-lanjing-runtime-owner": "blocked",
      "x-lanjing-sensitivity": "sensitive_url",
      "x-lanjing-support": "blocked"
    },
    "lastUpdateTime": {
      "description": "上游客户端排序用更新时间；兼容 Long 与历史字符串表示",
      "oneOf": [
        {
          "oneOf": [
            {
              "type": "integer"
            },
            {
              "pattern": "^-?[0-9]+$",
              "type": "string"
            }
          ]
        },
        {
          "type": "null"
        }
      ],
      "x-lanjing-group": "preferences",
      "x-lanjing-importer-owner": "lj-importer::authoring::document",
      "x-lanjing-runtime-owner": "not_executable",
      "x-lanjing-sensitivity": "none",
      "x-lanjing-support": "preserved"
    },
    "loginCheckJs": {
      "description": "上游登录检测 JavaScript",
      "oneOf": [
        {
          "maxLength": 262144,
          "type": "string",
          "x-lanjing-max-utf8-bytes": 262144
        },
        {
          "type": "null"
        }
      ],
      "x-lanjing-group": "basic",
      "x-lanjing-importer-owner": "lj-importer::authoring::document",
      "x-lanjing-runtime-owner": "blocked",
      "x-lanjing-sensitivity": "none",
      "x-lanjing-support": "blocked"
    },
    "loginUi": {
      "description": "上游自定义登录界面",
      "oneOf": [
        {
          "maxLength": 262144,
          "type": "string",
          "x-lanjing-max-utf8-bytes": 262144
        },
        {
          "type": "null"
        }
      ],
      "x-lanjing-group": "basic",
      "x-lanjing-importer-owner": "lj-importer::authoring::document",
      "x-lanjing-runtime-owner": "blocked",
      "x-lanjing-sensitivity": "none",
      "x-lanjing-support": "blocked"
    },
    "loginUrl": {
      "description": "上游登录地址；本版本不提供登录或 WebView",
      "oneOf": [
        {
          "maxLength": 262144,
          "type": "string",
          "x-lanjing-max-utf8-bytes": 262144
        },
        {
          "type": "null"
        }
      ],
      "x-lanjing-group": "basic",
      "x-lanjing-importer-owner": "lj-importer::authoring::document",
      "x-lanjing-runtime-owner": "blocked",
      "x-lanjing-sensitivity": "sensitive_url",
      "x-lanjing-support": "blocked"
    },
    "respondTime": {
      "description": "上游客户端排序用响应耗时",
      "oneOf": [
        {
          "type": "integer"
        },
        {
          "type": "null"
        }
      ],
      "x-lanjing-group": "preferences",
      "x-lanjing-importer-owner": "lj-importer::authoring::document",
      "x-lanjing-runtime-owner": "not_executable",
      "x-lanjing-sensitivity": "none",
      "x-lanjing-support": "preserved"
    },
    "ruleBookInfo": {
      "description": "详情规则对象；compact string 在 v1 阻断",
      "oneOf": [
        {
          "oneOf": [
            {
              "additionalProperties": true,
              "properties": {},
              "type": "object"
            },
            {
              "maxLength": 262144,
              "type": "string",
              "x-lanjing-max-utf8-bytes": 262144
            }
          ],
          "x-lanjing-string-support": "blocked"
        },
        {
          "type": "null"
        }
      ],
      "x-lanjing-group": "book_info",
      "x-lanjing-importer-owner": "lj-importer::legado::translator",
      "x-lanjing-runtime-owner": "lj-node-extract::ExtractEffectAdapter",
      "x-lanjing-sensitivity": "none",
      "x-lanjing-support": "executable"
    },
    "ruleContent": {
      "description": "正文规则对象；compact string 在 v1 阻断",
      "oneOf": [
        {
          "oneOf": [
            {
              "additionalProperties": true,
              "properties": {},
              "type": "object"
            },
            {
              "maxLength": 262144,
              "type": "string",
              "x-lanjing-max-utf8-bytes": 262144
            }
          ],
          "x-lanjing-string-support": "blocked"
        },
        {
          "type": "null"
        }
      ],
      "x-lanjing-group": "content",
      "x-lanjing-importer-owner": "lj-importer::legado::translator",
      "x-lanjing-runtime-owner": "lj-node-extract::ExtractEffectAdapter",
      "x-lanjing-sensitivity": "none",
      "x-lanjing-support": "executable"
    },
    "ruleExplore": {
      "description": "发现列表规则对象；compact string 在 v1 阻断",
      "oneOf": [
        {
          "oneOf": [
            {
              "additionalProperties": true,
              "properties": {},
              "type": "object"
            },
            {
              "maxLength": 262144,
              "type": "string",
              "x-lanjing-max-utf8-bytes": 262144
            }
          ],
          "x-lanjing-string-support": "blocked"
        },
        {
          "type": "null"
        }
      ],
      "x-lanjing-group": "explore",
      "x-lanjing-importer-owner": "lj-importer::legado::translator",
      "x-lanjing-runtime-owner": "lj-node-extract::ExtractEffectAdapter",
      "x-lanjing-sensitivity": "none",
      "x-lanjing-support": "executable"
    },
    "ruleReview": {
      "description": "段评与交互规则；v1 不执行",
      "oneOf": [
        {
          "oneOf": [
            {
              "additionalProperties": true,
              "properties": {},
              "type": "object"
            },
            {
              "maxLength": 262144,
              "type": "string",
              "x-lanjing-max-utf8-bytes": 262144
            }
          ],
          "x-lanjing-string-support": "blocked"
        },
        {
          "type": "null"
        }
      ],
      "x-lanjing-group": "review",
      "x-lanjing-importer-owner": "lj-importer::authoring::document",
      "x-lanjing-runtime-owner": "blocked",
      "x-lanjing-sensitivity": "none",
      "x-lanjing-support": "blocked"
    },
    "ruleSearch": {
      "description": "搜索规则对象；上游 compact string 表示在 v1 阻断",
      "oneOf": [
        {
          "oneOf": [
            {
              "additionalProperties": true,
              "properties": {},
              "type": "object"
            },
            {
              "maxLength": 262144,
              "type": "string",
              "x-lanjing-max-utf8-bytes": 262144
            }
          ],
          "x-lanjing-string-support": "blocked"
        },
        {
          "type": "null"
        }
      ],
      "x-lanjing-group": "search",
      "x-lanjing-importer-owner": "lj-importer::legado::translator",
      "x-lanjing-runtime-owner": "lj-node-extract::ExtractEffectAdapter",
      "x-lanjing-sensitivity": "none",
      "x-lanjing-support": "executable"
    },
    "ruleToc": {
      "description": "目录规则对象；compact string 在 v1 阻断",
      "oneOf": [
        {
          "oneOf": [
            {
              "additionalProperties": true,
              "properties": {},
              "type": "object"
            },
            {
              "maxLength": 262144,
              "type": "string",
              "x-lanjing-max-utf8-bytes": 262144
            }
          ],
          "x-lanjing-string-support": "blocked"
        },
        {
          "type": "null"
        }
      ],
      "x-lanjing-group": "toc",
      "x-lanjing-importer-owner": "lj-importer::legado::translator",
      "x-lanjing-runtime-owner": "lj-node-extract::ExtractEffectAdapter",
      "x-lanjing-sensitivity": "none",
      "x-lanjing-support": "executable"
    },
    "searchUrl": {
      "description": "搜索 URL 模板，可使用 {{key}} 与 {{page}}",
      "oneOf": [
        {
          "maxLength": 262144,
          "type": "string",
          "x-lanjing-max-utf8-bytes": 262144
        },
        {
          "type": "null"
        }
      ],
      "x-lanjing-group": "search",
      "x-lanjing-importer-owner": "lj-importer::legado::translator",
      "x-lanjing-runtime-owner": "lj-node-http::HttpEffectAdapter",
      "x-lanjing-sensitivity": "sensitive_url",
      "x-lanjing-support": "executable"
    },
    "variableComment": {
      "description": "来源变量说明",
      "oneOf": [
        {
          "maxLength": 262144,
          "type": "string",
          "x-lanjing-max-utf8-bytes": 262144
        },
        {
          "type": "null"
        }
      ],
      "x-lanjing-group": "basic",
      "x-lanjing-importer-owner": "lj-importer::authoring::document",
      "x-lanjing-runtime-owner": "not_executable",
      "x-lanjing-sensitivity": "none",
      "x-lanjing-support": "preserved"
    },
    "weight": {
      "description": "上游搜索排序权重",
      "oneOf": [
        {
          "type": "integer"
        },
        {
          "type": "null"
        }
      ],
      "x-lanjing-group": "preferences",
      "x-lanjing-importer-owner": "lj-importer::authoring::document",
      "x-lanjing-runtime-owner": "not_executable",
      "x-lanjing-sensitivity": "none",
      "x-lanjing-support": "preserved"
    }
  },
  "required": [
    "bookSourceType",
    "bookSourceUrl",
    "bookSourceName"
  ],
  "title": "LanJing Legado Source Authoring Schema v1",
  "type": "object",
  "x-lanjing-generator-version": 1,
  "x-lanjing-limits": {
    "max_depth": 64,
    "max_nodes": 100000,
    "max_properties": 32768,
    "max_property_name_utf8_bytes": 1024,
    "max_string_utf8_bytes": 262144,
    "max_utf8_bytes": 2097152
  },
  "x-lanjing-schema-version": 1
}
