{"bookSourceComment":"//合成测试书源,非真实规则,无版权问题","bookSourceGroup":"测试源","bookSourceName":"目录下一页测试书源","bookSourceType":0,"bookSourceUrl":"https://example.com","ruleContent":{"content":"#article@html","nextContentUrl":".pager .next@href"},"ruleSearch":{"author":"p[itemprop='author']@text","bookList":"li[itemprop='mainEntity']","bookUrl":"a[itemprop='url']@href","name":"h2[itemprop='name']@text"},"ruleToc":{"chapterList":"#full-catalog a[href*='/read/']","chapterName":"text","chapterUrl":"href","nextTocUrl":".pager .next@href"},"searchUrl":"/search?q={{key}}&page={{page}}"}
